{
  "metadata": {
    "id": "BSA-001",
    "domain": "dsa",
    "topic": "binary search",
    "subtopic": "binary search on answer",
    "difficulty": {
      "codeforces_rating": 1400,
      "tier": "medium"
    },
    "tags": [
      "binary search",
      "greedy",
      "arrays",
      "sorting",
      "implementation"
    ],
    "bloom_level": "apply",
    "prerequisites": [
      "binary search on sorted arrays",
      "basic sorting and array traversal",
      "greedy algorithms fundamentals",
      "time complexity analysis",
      "understanding of O(log N) search spaces"
    ],
    "generated_at": "2026-07-17T00:00:00Z",
    "pipeline_rounds": 1
  },
  "problem": {
    "title": "Lab Assignment",
    "story": "A research institute is planning a series of N experiments that must be conducted in a fixed sequential order. The institute has K identical laboratories available. The director needs to assign each experiment to a laboratory such that each laboratory receives a contiguous block of experiments (i.e., experiments with consecutive indices). The total difficulty of a laboratory is the sum of difficulties of all experiments assigned to it. The director wants to minimize the maximum total difficulty among all laboratories to ensure a balanced workload.",
    "statement": "You are given N experiments with difficulties D₁, D₂, ..., Dₙ that must be performed in order. You must partition these experiments into exactly K non-empty contiguous groups (a group consists of experiments with consecutive indices). The cost of a group is the sum of difficulties of all experiments in it. Your goal is to minimize the maximum cost among all K groups.\n\nFormally, you must choose K-1 split points 1 ≤ p₁ < p₂ < ... < p_{K-1} < N such that the groups are:\n- Group 1: D₁, D₂, ..., D_{p₁}\n- Group 2: D_{p₁+1}, ..., D_{p₂}\n- ...\n- Group K: D_{p_{K-1}+1}, ..., Dₙ\n\nMinimize the maximum sum among all K groups.",
    "input_format": {
      "line_1": "Two space-separated integers N and K — the number of experiments and the number of laboratories.",
      "line_2": "N space-separated integers D₁, D₂, ..., Dₙ — the difficulties of the experiments."
    },
    "output_format": "Print a single integer — the minimum possible value of the maximum total difficulty among all K laboratories.",
    "constraints": [
      "1 ≤ K ≤ N ≤ 10⁵",
      "1 ≤ Dᵢ ≤ 10⁹",
      "Time limit: 2 seconds",
      "Memory limit: 256 MB"
    ],
    "sample_tests": [
      {
        "input": "5 2\n5 3 1 7 1",
        "output": "9",
        "explanation": "We must split [5, 3, 1, 7, 1] into 2 contiguous groups. The optimal partition is [5, 3, 1] and [7, 1], with costs 9 and 8. The maximum cost is 9. No partition achieves a smaller maximum: [5, 3] and [1, 7, 1] gives max(8, 9) = 9; [5] and [3, 1, 7, 1] gives max(5, 12) = 12."
      },
      {
        "input": "4 4\n2 6 3 4",
        "output": "6",
        "explanation": "With N = K = 4, each laboratory must receive exactly one experiment. The costs are the individual difficulties: 2, 6, 3, 4. The maximum is 6."
      },
      {
        "input": "6 3\n6 1 2 4 3 2",
        "output": "7",
        "explanation": "We must split [6, 1, 2, 4, 3, 2] into 3 contiguous groups. The optimal partition is [6, 1], [2, 4], [3, 2], with costs 7, 6, 5. The maximum cost is 7. We cannot achieve 6: the first element alone is 6, so the first group can only be [6], then [1, 2] = 3, then [4] exceeds 6 when combined with anything after, requiring a 4th group. So 7 is optimal."
      }
    ],
    "notes": [
      "The answer can be as large as N × max(Dᵢ) = 10¹⁴, which exceeds the range of 32-bit integers. Use 64-bit integer types.",
      "Each group must be non-empty and contiguous. The order of experiments cannot be changed."
    ],
    "subtasks": [
      {
        "points": 30,
        "constraints": [
          "1 ≤ K ≤ N ≤ 10",
          "1 ≤ Dᵢ ≤ 100"
        ],
        "description": "Small constraints — brute force or exponential approaches are feasible."
      },
      {
        "points": 70,
        "constraints": [
          "1 ≤ K ≤ N ≤ 10⁵",
          "1 ≤ Dᵢ ≤ 10⁹"
        ],
        "description": "Full constraints — requires an efficient approach."
      }
    ]
  },
  "solution": {
    "approach": "Binary search on the answer. We binary search on the maximum total difficulty D. For each candidate D, we check feasibility using a greedy algorithm: scan experiments left to right, adding each to the current lab; if adding the next experiment would exceed D, start a new lab. If we need at most K labs, D is feasible. The key insight is that feasibility is monotonic: if D is feasible, then D+1 is also feasible.",
    "pseudocode": [
      "function feasible(D, experiments, N, K):",
      "    labs_needed = 1",
      "    current_sum = 0",
      "    for i = 0 to N - 1:",
      "        if experiments[i] > D:",
      "            return false",
      "        if current_sum + experiments[i] > D:",
      "            labs_needed = labs_needed + 1",
      "            current_sum = experiments[i]",
      "            if labs_needed > K:",
      "                return false",
      "        else:",
      "            current_sum = current_sum + experiments[i]",
      "    return true",
      "",
      "function solve():",
      "    read N, K",
      "    read array D of N integers",
      "",
      "    lo = max(D)",
      "    hi = sum(D)",
      "",
      "    while lo < hi:",
      "        mid = lo + (hi - lo) / 2",
      "        if feasible(mid, D, N, K):",
      "            hi = mid",
      "        else:",
      "            lo = mid + 1",
      "",
      "    print lo"
    ],
    "time_complexity": "O(N × log(sum(D))) — binary search over [max(D), sum(D)] gives ~47 iterations, each with O(N) feasibility check. Total: ~4.7 × 10⁶ operations for N = 10⁵.",
    "space_complexity": "O(N) — to store the array of N experiment difficulties.",
    "correctness_argument": "Monotonicity: if f(D) is feasible (greedy uses ≤ K labs), then f(D+1) is also feasible because increasing the limit can only reduce or maintain the number of labs needed. Binary search finds the minimum feasible D.",
    "solvability_verdict": "success"
  },
  "test_suite": {
    "test_cases": [
      {"id": "basic_1", "category": "basic", "input": "5 2\n5 3 1 7 1", "expected_output": "9", "purpose": "Sample test 1: basic 2-way partition."},
      {"id": "basic_2", "category": "basic", "input": "4 4\n2 6 3 4", "expected_output": "6", "purpose": "Sample test 2: N = K, answer is max element."},
      {"id": "basic_3", "category": "basic", "input": "6 3\n6 1 2 4 3 2", "expected_output": "7", "purpose": "Sample test 3: moderate 3-way partition."},
      {"id": "basic_4", "category": "basic", "input": "4 2\n3 3 3 3", "expected_output": "6", "purpose": "All elements equal, uniform split."},
      {"id": "edge_1", "category": "edge_case", "input": "1 1\n10", "expected_output": "10", "purpose": "Minimum input N=1, K=1."},
      {"id": "edge_2", "category": "edge_case", "input": "5 5\n1 2 3 4 5", "expected_output": "5", "purpose": "K = N with varying elements."},
      {"id": "edge_3", "category": "edge_case", "input": "5 2\n1 1 100 1 1", "expected_output": "102", "purpose": "Dominant middle element forces suboptimal grouping."},
      {"id": "edge_4", "category": "edge_case", "input": "6 3\n7 7 7 7 7 7", "expected_output": "14", "purpose": "All identical elements, K=3."},
      {"id": "edge_5", "category": "edge_case", "input": "2 1\n1000000000 1000000000", "expected_output": "2000000000", "purpose": "K=1 with max values, tests 64-bit overflow."},
      {"id": "adv_1", "category": "adversarial", "input": "6 2\n10 1 1 10 1 1", "expected_output": "12", "purpose": "Breaks sort-and-distribute approach."},
      {"id": "adv_2", "category": "adversarial", "input": "8 3\n3 1 1 1 1 1 1 3", "expected_output": "4", "purpose": "Breaks equal-count partition approach."},
      {"id": "adv_3", "category": "adversarial", "input": "8 3\n1 2 3 4 5 6 3 4", "expected_output": "11", "purpose": "Breaks ceil(sum/K) approach."},
      {"id": "bound_1", "category": "boundary", "input": "100000 2\n(all 100000 elements are 1000000000)", "expected_output": "50000000000000", "purpose": "Max N and max values with K=2."},
      {"id": "bound_2", "category": "boundary", "input": "5 3\n1000000000 1000000000 1000000000 1000000000 1000000000", "expected_output": "2000000000", "purpose": "All max values, K=3, tests overflow."},
      {"id": "bound_3", "category": "boundary", "input": "10 3\n1000000000 1000000000 1000000000 1000000000 1000000000 1000000000 1000000000 1000000000 1000000000 1000000000", "expected_output": "4000000000", "purpose": "All max values, K=3, large answer."}
    ],
    "stress_test_config": {
      "random_tests": 500,
      "n_range": [1, 50],
      "comparison": "Run brute force (enumerate all partitions) and reference solution on each random input. Compare outputs."
    },
    "coverage_report": {
      "edge_cases_covered": [
        "N=1 minimum input",
        "K=N all individual groups",
        "K=1 single group",
        "All elements identical",
        "Dominant middle element",
        "Maximum values causing 64-bit overflow",
        "Large N at constraint boundary"
      ],
      "wrong_approaches_tested": [
        "Sort and distribute: tested by adv_1",
        "Equal-count partition: tested by adv_2",
        "ceil(sum/K) as answer: tested by adv_3"
      ]
    }
  },
  "editorial": {
    "hints": [
      "Hint 1: The problem asks you to minimize the maximum group sum. Whenever you see 'minimize the maximum' or 'maximize the minimum,' consider whether binary search on the answer could work. Ask yourself: if I fix the answer to some value D, can I efficiently check whether D is achievable?",